Symbol,Name,Last Sale,Net Change,% Change,Market Cap,Country,IPO Year,Volume,Sector,Industry
PEB^F,Pebblebrook Hotel Trust 6.3% Series F Cumulative Redeemable Preferred Shares of Beneficial Interest,$21.86,0.36,1.674%,,United States,,1998,,
PEB^G,Pebblebrook Hotel Trust 6.375% Series G Cumulative Redeemable Preferred Shares of Beneficial Interest,$21.25,0.35,1.675%,,United States,,6778,,
PEB^H,Pebblebrook Hotel Trust 5.700% Series H Cumulative Redeemable Preferred Shares of Beneficial Interest,$19.13,0.03,0.157%,,United States,,32749,,
PEG,Public Service Enterprise Group Incorporated Common Stock,$58.42,0.22,0.378%,29111521523.00,United States,,1436466,Utilities,Power Generation
PEN,Penumbra Inc. Common Stock,$273.04,0.70,0.257%,10538351773.00,United States,2015,231297,Health Care,Medical/Dental Instruments
PEO,Adams Natural Resources Fund Inc. Common Stock,$20.55,-0.25,-1.202%,0.00,United States,,56160,Finance,Finance/Investors Services
PERF,Perfect Corp. Class A Ordinary Share,$2.41,-0.03,-1.23%,244566800.00,Taiwan,2022,752,Technology,Computer Software: Prepackaged Software
PFD,Flaherty & Crumrine Preferred and Income Fund Incorporated,$10.15,0.04,0.396%,0.00,United States,1991,11323,Finance,Investment Managers
PFE,Pfizer Inc. Common Stock,$27.56,-0.01,-0.036%,155615150328.00,United States,,29039492,Health Care,Biotechnology: Pharmaceutical Preparations
PFGC,Performance Food Group Company Common Stock,$71.71,-0.86,-1.185%,11157062594.00,United States,2015,1298863,Consumer Discretionary,Food Distributors
PFH,Prudential Financial Inc. 4.125% Junior Subordinated Notes due 2060,$20.85,0.16,0.773%,57404550306.00,United States,2020,26210,Finance,Life Insurance
PFL,PIMCO Income Strategy Fund Shares of Beneficial Interest,$8.38,-0.08,-0.946%,0.00,United States,2003,91501,Finance,Finance Companies
PFLT,PennantPark Floating Rate Capital Ltd. Common Stock,$11.38,0.08,0.708%,701325286.00,United States,2022,758899,Finance,Finance/Investors Services
PFN,PIMCO Income Strategy Fund II,$7.50,-0.04,-0.531%,0.00,United States,2004,372693,Finance,Finance/Investors Services
PFO,Flaherty & Crumrine Preferred and Income Opportunity Fund Incorporated,$8.21,0.04,0.49%,0.00,United States,1992,27663,Finance,Finance Companies
PFS,Provident Financial Services Inc Common Stock,$15.65,0.52,3.437%,1183242241.00,United States,2003,887505,Finance,Savings Institutions
PFSI,PennyMac Financial Services Inc. Common Stock,$91.21,0.94,1.041%,4553727840.00,United States,2013,202053,Finance,Finance: Consumer Services
PG,Procter & Gamble Company (The) Common Stock,$157.42,-1.22,-0.769%,370412574321.00,United States,,5978046,Consumer Discretionary,Package Goods/Cosmetics
PGP,Pimco Global StocksPlus & Income Fund Common Shares of Beneficial Interest,$7.38,-0.03,-0.405%,0.00,United States,2005,65781,Finance,Finance Companies
PGR,Progressive Corporation (The) Common Stock,$182.72,-0.24,-0.131%,106898674527.00,United States,,1968746,Finance,Property-Casualty Insurers
PGRE,Paramount Group Inc. Common Stock,$4.65,0.04,0.868%,1010693808.00,United States,2014,985350,Real Estate,Real Estate Investment Trusts
PGRU,PropertyGuru Group Limited Ordinary Shares,$3.30,0.08,2.484%,536514000.00,,2022,1798,Technology,EDP Services
PGSS,Pegasus Digital Mobility Acquisition Corp. Class A Ordinary Shares,$11.21,0.015,0.134%,0.00,,2021,3288,Finance,Blank Checks
PGTI,PGT Innovations Inc.,$41.34,0.01,0.024%,2358442659.00,United States,2006,523284,Industrials,Building Products
PGZ,Principal Real Estate Income Fund Common Shares of Beneficial Interest,$10.17,0.02,0.197%,0.00,,2013,25881,Finance,Investment Managers
PH,Parker-Hannifin Corporation Common Stock,$521.38,5.87,1.139%,66950851059.00,United States,,565277,Industrials,Metal Fabrications
PHD,Pioneer Floating Rate Fund Inc.,$9.68,0.01,0.103%,0.00,United States,2004,37334,Finance,Investment Managers
PHG,Koninklijke Philips N.V. NY Registry Shares,$20.60,0.10,0.488%,18158498856.00,Netherlands,,611571,Health Care,Medical Electronics
PHI,PLDT Inc. Sponsored ADR,$23.38,0.23,0.994%,5051384020.00,Philippines,,25430,Telecommunications,Telecommunications Equipment
PHIN,PHINIA Inc. Common Stock,$30.09,0.05,0.166%,1404761189.00,United States,2023,391793,,
PHK,Pimco High Income Fund,$4.97,-0.02,-0.401%,0.00,United States,2003,360905,Finance,Finance/Investors Services
PHM,PulteGroup Inc. Common Stock,$103.10,-0.16,-0.155%,21868794111.00,United States,,1695511,Consumer Discretionary,Homebuilding
PHR,Phreesia Inc. Common Stock,$27.91,0.89,3.294%,1552771231.00,United States,2019,447849,Consumer Discretionary,Business Services
PHT,Pioneer High Income Fund Inc.,$7.42,-0.003,-0.04%,0.00,United States,,61048,Finance,Investment Managers
PHX,PHX Minerals Inc. Common Stock,$2.99,-0.05,-1.645%,110631017.00,United States,2003,67898,Energy,Oil & Gas Production
PHYT,Pyrophyte Acquisition Corp. Class A Ordinary Shares,$11.11,0.00,0.00%,0.00,,2021,3,Finance,Blank Checks
PII,Polaris Inc. Common Stock,$91.06,0.15,0.165%,5142404335.00,United States,,766881,Consumer Discretionary,Industrial Specialties
PIM,Putnam Master Intermediate Income Trust Common Stock,$3.24,-0.01,-0.308%,162820997.00,United States,1988,19620,Finance,Finance Companies
PINE,Alpine Income Property Trust Inc. Common Stock,$15.55,0.33,2.168%,213034394.00,United States,2019,54045,Real Estate,Real Estate Investment Trusts
PINS,Pinterest Inc. Class A Common Stock,$36.87,-3.85,-9.455%,24863599038.00,United States,2019,42738903,Technology,Computer Software: Programming Data Processing
PIPR,Piper Sandler Companies Common Stock,$186.72,2.78,1.511%,3306730537.00,United States,,110080,Finance,Investment Bankers/Brokers/Service
PJT,PJT Partners Inc. Class A Common Stock,$97.39,1.97,2.065%,2360789599.00,United States,2015,313415,Finance,Investment Managers
PK,Park Hotels & Resorts Inc. Common Stock ,$15.19,-0.07,-0.459%,3189652768.00,United States,2016,2094854,Consumer Discretionary,Hotels/Resorts
PKE,Park Aerospace Corp. Common Stock,$14.60,0.03,0.206%,295699071.00,United States,,44091,Industrials,Military/Government/Technical
PKG,Packaging Corporation of America Common Stock,$168.33,1.46,0.875%,15086457914.00,United States,2000,474501,Consumer Discretionary,Containers/Packaging
PKST,Peakstone Realty Trust Common Shares,$15.40,0.40,2.667%,554602895.00,United States,2023,137603,Real Estate,Real Estate Investment Trusts
PKX,POSCO Holdings Inc. American Depositary Shares (Each representing 1/4th of a share of Common Stock),$85.03,0.70,0.83%,25797822081.00,South Korea,1994,81025,Industrials,Steel/Iron Ore
PL,Planet Labs PBC Class A Common Stock,$2.32,0.11,4.977%,667292209.00,United States,2021,1125862,Industrials,Aerospace
PLD,Prologis Inc. Common Stock,$132.48,0.82,0.623%,122407678080.00,United States,,2856299,Real Estate,Real Estate Investment Trusts
PLNT,Planet Fitness Inc. Common Stock,$69.95,-0.19,-0.271%,6165876494.00,United States,2015,928401,Consumer Discretionary,Hotels/Resorts
PLOW,Douglas Dynamics Inc. Common Stock,$25.10,0.31,1.251%,576897522.00,United States,2010,179798,Industrials,Construction/Ag Equipment/Trucks
PLTR,Palantir Technologies Inc. Class A Common Stock,$24.38,-0.13,-0.53%,53050620816.00,United States,2020,148731621,Technology,Retail: Computer Software & Peripheral Equipment
PLYM,Plymouth Industrial REIT Inc. Common Stock,$22.27,0.16,0.724%,1007721598.00,United States,2017,216279,Real Estate,Real Estate Investment Trusts
PM,Philip Morris International Inc Common Stock,$89.12,0.11,0.124%,138350421918.00,United States,,4966339,Health Care, Medicinal Chemicals and Botanical Products 
PMF,PIMCO Municipal Income Fund Common Stock,$9.47,-0.02,-0.211%,0.00,United States,2001,14835,Finance,Finance/Investors Services
PML,Pimco Municipal Income Fund II Common Shares of Beneficial Interest,$8.51,-0.04,-0.468%,0.00,United States,2002,183082,Finance,Investment Managers
PMM,Putnam Managed Municipal Income Trust Common Stock,$6.18,0.02,0.325%,301205840.00,United States,1989,105319,Finance,Investment Managers
PMO,Putnam Municipal Opportunities Trust Common Stock,$10.43,0.06,0.579%,354427744.00,United States,1993,69066,Finance,Finance Companies
PMT,PennyMac Mortgage Investment Trust Common Shares of Beneficial Interest,$13.79,0.24,1.771%,1194545567.00,United States,2009,700491,Real Estate,Real Estate Investment Trusts
PMT^A,PennyMac Mortgage Investment Trust 8.125% Series A Fixed-to-Floating Rate Cumulative Redeemable Preferred Shares of Beneficial Interest,$23.46,0.12,0.514%,,United States,,37465,,
PMT^B,PennyMac Mortgage Investment Trust 8.00% Series B Fixed-to-Floating Rate Cumulative Redeemable Preferred Shares of Beneficial Interest,$23.4801,0.0201,0.086%,,United States,,22007,,
PMT^C,PennyMac Mortgage Investment Trust 6.75% Series C Cumulative Redeemable Preferred Shares of Beneficial Interest,$19.76,0.0984,0.50%,,United States,,20585,,
PMTU,PennyMac Mortgage Investment Trust 8.50% Senior Notes due 2028,$25.35,0.15,0.595%,0.00,United States,2023,4644,,
PMX,PIMCO Municipal Income Fund III Common Shares of Beneficial Interest,$7.52,-0.04,-0.529%,0.00,United States,2002,63721,Finance,Trusts Except Educational Religious and Charitable
PNC,PNC Financial Services Group Inc. (The) Common Stock,$147.77,-0.16,-0.108%,58862865825.00,United States,,1157618,Finance,Major Banks
PNF,PIMCO New York Municipal Income Fund Common Stock,$8.27,0.00,0.00%,0.00,United States,2001,59488,Finance,Finance Companies
PNI,Pimco New York Municipal Income Fund II Common Shares of Beneficial Interest,$7.66,0.06,0.789%,0.00,United States,2002,44986,Finance,Trusts Except Educational Religious and Charitable
PNM,PNM Resources Inc. (Holding Co.) Common Stock,$36.99,-0.09,-0.243%,3175031989.00,United States,,909466,Utilities,Electric Utilities: Central
PNNT,PennantPark Investment Corporation Common Stock,$6.73,-0.03,-0.444%,438960885.00,United States,2022,686186,Finance,Finance/Investors Services
PNR,Pentair plc. Ordinary Share,$74.48,0.04,0.054%,12311466466.00,Switzerland,,1394218,Industrials,Industrial Machinery/Components
PNST,Pinstripes Holdings Inc. Class A Common Stock,$3.42,-0.02,-0.581%,38453410.00,,2022,61192,Finance,Blank Checks
PNW,Pinnacle West Capital Corporation Common Stock,$67.00,0.61,0.919%,7597689182.00,United States,,1060555,Utilities,Electric Utilities: Central
POR,Portland General Electric Co Common Stock,$40.11,0.50,1.262%,4056079749.00,United States,,627692,Utilities,Electric Utilities: Central
PORT,Southport Acquisition Corporation Class A Common Stock,$10.69,0.00,0.00%,0.00,,2022,3385,Finance,Blank Checks
POST,Post Holdings Inc. Common Stock,$104.77,-1.70,-1.597%,6357571210.00,United States,2012,723671,Consumer Staples,Packaged Foods
PPG,PPG Industries Inc. Common Stock,$139.58,0.95,0.685%,32912964000.00,United States,,1205668,Consumer Discretionary,Paints/Coatings
PPL,PPL Corporation Common Stock,$25.87,0.21,0.818%,19069407943.00,United States,,5478846,Utilities,Electric Utilities: Central
PPT,Putnam Premier Income Trust Common Stock,$3.68,-0.02,-0.541%,366264008.00,United States,1988,110062,Finance,Finance Companies
PR,Permian Resources Corporation Class A Common Stock,$13.43,-0.09,-0.666%,10391688433.00,United States,2022,6266496,Energy,Oil & Gas Production
PRA,ProAssurance Corporation Common Stock,$13.08,0.17,1.317%,666679006.00,United States,,223620,Finance,Property-Casualty Insurers
PRE^J,PartnerRe Ltd. 4.875% Fixed Rate Non-Cumulative Redeemable Preferred Shares Series J,$20.23,0.15,0.747%,,Bermuda,,17641,,
PRG,PROG Holdings Inc. Common Stock,$33.09,0.72,2.224%,1479859650.00,United States,,292276,Consumer Discretionary,Diversified Commercial Services
PRGO,Perrigo Company plc Ordinary Shares,$31.88,0.02,0.063%,4319946869.00,United States,,825694,Health Care,Biotechnology: Pharmaceutical Preparations
PRH,Prudential Financial Inc. 5.950% Junior Subordinated Notes due 2062,$25.96,0.07,0.27%,9371560000.00,United States,2022,14705,Finance,Life Insurance
PRI,Primerica Inc. Common Stock,$242.46,6.53,2.768%,8494336366.00,United States,2010,137930,Finance,Life Insurance
PRIF^D,Priority Income Fund Inc. 7.00% Series D Term Preferred Stock due 2029,$22.95,-0.19,-0.821%,,,,481,,
PRIF^F,Priority Income Fund Inc. 6.625% Series F Term Preferred Stock due 2027,$23.30,0.00,0.00%,,,,33,,
PRIF^G,Priority Income Fund Inc. 6.25% Series G Preferred Stock Due 2026,$23.40,-0.20,-0.847%,,,,147,,
PRIF^H,Priority Income Fund Inc. 6.00% Series H Term Preferred Stock due 2026,$23.20,-0.01,-0.043%,,,,2494,,
PRIF^I,Priority Income Fund Inc. 6.125% Series I Term Preferred Stock due 2028,$22.3554,0.0504,0.226%,,,,890,,
PRIF^J,Priority Income Fund Inc. 6.000% Series J Term Preferred Stock due 2028,$22.2699,0.00,0.00%,,,,57,,
PRIF^K,Priority Income Fund Inc. 7.000% Series K Cumulative Preferred Stock,$20.55,0.4602,2.291%,,,,1763,,
PRIF^L,Priority Income Fund Inc. 6.375% Series L Term Preferred Stock Due 2029,$23.34,0.20,0.864%,,,,1057,,
PRIM,Primoris Services Corporation Common Stock,$37.45,1.03,2.828%,1998347392.00,United States,,369802,Industrials,Water Sewer Pipeline Comm & Power Line Construction
PRLB,Proto Labs Inc. Common stock,$35.58,-1.61,-4.329%,917462429.00,United States,2012,496587,Industrials,Office Equipment/Supplies/Services
PRM,Perimeter Solutions SA Ordinary Shares,$5.12,0.14,2.811%,782255606.00,Luxembourg,2021,528328,Consumer Discretionary,Newspapers/Magazines
PRMW,Primo Water Corporation Common Stock,$14.63,-0.10,-0.679%,2332144073.00,Canada,,649014,Consumer Staples,Farming/Seeds/Milling
PRO,PROS Holdings Inc. Common Stock,$36.75,0.74,2.055%,1700107479.00,United States,2007,1401476,Technology,EDP Services
PRS,Prudential Financial Inc. 5.625% Junior Subordinated Notes due 2058,$25.09,0.08,0.32%,9057490000.00,United States,2018,20309,Finance,Life Insurance
PRT,PermRock Royalty Trust Trust Units,$4.24,-0.11,-2.529%,51582704.00,United States,2018,67323,Energy,Oil & Gas Production
PRU,Prudential Financial Inc. Common Stock,$105.58,-3.03,-2.79%,38114380000.00,United States,2001,2616462,Finance,Life Insurance
PSA,Public Storage Common Stock,$284.07,-0.83,-0.291%,49949778539.00,United States,,557044,Real Estate,Real Estate Investment Trusts
PSA^F,Public Storage Depositary Shares Each Representing 1/1000 of a 5.15% Cumulative Preferred Share of Beneficial Interest Series F par value $0.01 per share,$24.60,0.15,0.613%,,United States,,13297,,
PSA^G,Public Storage Depositary Shares Each Representing 1/1000 of a 5.05% Cumulative Preferred Share of Beneficial Interest Series G,$24.73,0.13,0.528%,,United States,,29971,,
PSA^H,Public Storage Depositary Shares Each Representing 1/1000 of a  5.60% Cumulative Preferred  Share of Beneficial Interest Series H,$25.11,0.03,0.12%,,United States,,26347,,
PSA^I,Public Storage Depositary Shares Each Representing 1/1000 of a 4.875% Cumulative Preferred Share of Beneficial Interest Series I par value $0.01 per share,$23.44,0.20,0.861%,,United States,,9718,,
PSA^J,Public Storage Depositary Shares Each Representing 1/1000 of a 4.700% Cumulative Preferred Share of Beneficial Interest Series J par value $0.01 per share,$21.97,0.13,0.595%,,United States,,5416,,
PSA^K,Public Storage Depositary Shares Each Representing 1/1000 of a 4.75% Cumulative Preferred Share of Beneficial Interest Series K,$22.29,0.22,0.997%,,United States,,4503,,
PSA^L,Public Storage Depositary Shares Each Representing 1/1000 of a 4.625% Cumulative Preferred Share of Beneficial Interest Series L par value $0.01 per share,$21.99,0.19,0.872%,,United States,,25315,,
PSA^M,Public Storage Depositary Shares Each Representing 1/1000 of a 4.125% Cumulative Preferred Share of Beneficial Interest Series M,$19.53,0.18,0.93%,,United States,,5198,,
PSA^N,Public Storage Depositary Shares Each Representing 1/1000 of a 3.875% Cumulative Preferred Share of Beneficial Interest Series N,$17.98,0.11,0.616%,,United States,,7512,,
PSA^O,Public Storage Depositary Shares Each Representing 1/1000 of a 3.900% Cumulative Preferred Share of Beneficial Interest Series O,$18.27,0.20,1.107%,,United States,,8109,,
PSA^P,Public Storage Depositary Shares Each Representing 1/1000 of a 4.000% Cumulative Preferred Share of Bene cial Interest Series P,$18.9892,0.0992,0.525%,,United States,,23784,,
PSA^Q,Public Storage Depositary Shares Each Representing 1/1000 of a 3.950% Cumulative Preferred Share of Beneficial Interest Series Q par value $0.01 per share,$18.24,0.15,0.829%,,United States,,6249,,
PSA^R,Public Storage Depositary Shares Each Representing 1/1000 of a 4.00% Cumulative Preferred Share of Bene cial Interest Series R,$19.10,0.31,1.65%,,United States,,11863,,
PSA^S,Public Storage Depositary Shares Each Representing 1/1000 of a 4.100% Cumulative Preferred Share of Beneficial Interest Series S,$19.32,0.13,0.677%,,United States,,10879,,
PSBD,Palmer Square Capital BDC Inc. Common Stock,$16.28,0.13,0.805%,0.00,,2024,60701,,
PSEC^A,Prospect Capital Corporation 5.35% Series A Fixed Rate Cumulative Perpetual Preferred Stock,$18.38,-0.06,-0.325%,,United States,,18376,,
PSF,Cohen & Steers Select Preferred and Income Fund Inc. Common Stock,$19.44,0.02,0.103%,955254928.00,,2010,13014,Finance,Investment Managers
PSFE,Paysafe Limited Common Shares,$13.74,0.11,0.807%,847107177.00,,2021,202055,Consumer Discretionary,Business Services
PSN,Parsons Corporation Common Stock,$67.87,0.84,1.253%,7118812154.00,United States,2019,1067025,Technology,EDP Services
PSO,Pearson Plc Common Stock,$12.01,0.18,1.522%,8575140000.00,United Kingdom,,344217,Consumer Discretionary,Books
PSQH,PSQ Holdings Inc. Class A Common Stock,$4.62,0.05,1.094%,127621739.00,,2021,94698,Consumer Discretionary,Advertising
PSTG,Pure Storage Inc. Class A Common Stock,$44.75,0.61,1.382%,14139783695.00,United States,2015,2740517,Technology,Electronic Components
PSTL,Postal Realty Trust Inc. Class A Common Stock,$14.17,-0.02,-0.141%,307694323.00,United States,2019,86488,Real Estate,Real Estate Investment Trusts
PSX,Phillips 66 Common Stock,$145.66,-1.16,-0.79%,64083929055.00,United States,,2889041,Energy,Integrated oil Companies
PTA,Cohen & Steers Tax-Advantaged Preferred Securities and Income Fund Common Shares of Beneficial Interest,$18.94,0.06,0.318%,1046879276.00,United States,2020,105873,Finance,Trusts Except Educational Religious and Charitable
PTY,Pimco Corporate & Income Opportunity Fund,$13.99,-0.11,-0.78%,0.00,United States,2002,493828,Finance,Investment Managers
PUK,Prudential Public Limited Company Common Stock,$20.54,-0.46,-2.19%,28275526697.00,United Kingdom,,592486,Finance,Life Insurance
PUMP,ProPetro Holding Corp. Common Stock,$7.93,0.01,0.126%,874184985.00,United States,2017,1273185,Energy,Oilfield Services/Equipment
PVH,PVH Corp. Common Stock,$127.76,0.70,0.551%,7619287894.00,United States,,656535,Consumer Discretionary,Apparel
PVL,Permianville Royalty Trust Trust Units ,$1.61,0.00,0.00%,53130000.00,United States,2011,37052,Energy,Oil & Gas Production
PWR,Quanta Services Inc. Common Stock,$210.11,2.34,1.126%,30525808238.00,United States,,684240,Industrials,Engineering & Construction
PWSC,PowerSchool Holdings Inc. Class A Common Stock,$25.02,0.43,1.749%,5052552786.00,United States,2021,396437,Technology,Computer Software: Prepackaged Software
PX,P10 Inc. Class A Common Stock,$9.16,-0.06,-0.651%,1071323940.00,United States,2021,441956,Finance,Investment Managers
PXD,Pioneer Natural Resources Company Common Stock,$227.22,-4.54,-1.959%,53012444622.00,United States,,1544309,Energy,Oil & Gas Production
PYN,PIMCO New York Municipal Income Fund III Common Shares of Beneficial Interest,$5.90,-0.01,-0.169%,0.00,United States,2002,3567,Finance,Investment Managers
PYT,PPlus Tr GSC-2 Tr Ctf Fltg Rate,$22.94,0.1776,0.78%,0.00,United States,,5699,Finance,Finance: Consumer Services
PZC,PIMCO California Municipal Income Fund III Common Shares of Beneficial Interest,$7.49,0.00,0.00%,0.00,United States,2002,32348,Finance,Investment Managers
QBTS,D-Wave Quantum Inc. Common Shares,$1.09,0.16,17.204%,123607756.00,,2022,2615022,Technology,Retail: Computer Software & Peripheral Equipment
QD,Qudian Inc. American Depositary Shares each representing one Class A Ordinary Share,$2.31,0.11,5.00%,536489013.00,China,2017,929715,Finance,Finance: Consumer Services
QGEN,Qiagen N.V. Common Shares,$44.49,0.37,0.839%,9840918613.00,Netherlands,,1171134,Health Care,Biotechnology: Biological Products (No Diagnostic Substances)
QS,QuantumScape Corporation Class A Common Stock,$7.53,0.03,0.40%,3686396484.00,United States,2020,6996616,Consumer Discretionary,Auto Parts:O.E.M.
QSR,Restaurant Brands International Inc. Common Shares,$77.02,-0.17,-0.22%,24052069702.00,Canada,2014,1015689,,
QTWO,Q2 Holdings Inc. Common Stock,$43.20,0.54,1.266%,2533032216.00,United States,2014,396018,Technology,Computer Software: Prepackaged Software
QUAD,Quad Graphics Inc Class A Common Stock,$5.63,0.18,3.303%,288866106.00,United States,,130259,Consumer Discretionary,Publishing
QVCC,QVC Inc. 6.250% Senior Secured Notes due 2068,$12.7499,0.20,1.594%,13.00,United States,2019,23050,Consumer Discretionary,Catalog/Specialty Distribution
QVCD,QVC Inc. 6.375% Senior Secured Notes due 2067,$12.7242,0.1842,1.469%,0.00,United States,2018,6670,Consumer Discretionary,Catalog/Specialty Distribution
R,Ryder System Inc. Common Stock,$117.12,0.37,0.317%,5191021100.00,United States,,336020,Consumer Discretionary,Rental/Leasing Companies
RA,Brookfield Real Assets Income Fund Inc. Common Stock,$12.86,-0.08,-0.618%,0.00,United States,2016,279673,Finance,Investment Managers
RACE,Ferrari N.V. Common Shares,$392.56,7.41,1.924%,96293951662.00,Italy,2015,252822,Consumer Discretionary,Auto Manufacturing
RAMP,LiveRamp Holdings Inc. Common Stock,$38.85,-3.11,-7.412%,2545097338.00,United States,2018,2222479,Technology,EDP Services
RBA,RB Global Inc. Common Stock,$68.64,0.67,0.986%,12515321539.00,Canada,,794661,Consumer Discretionary,Business Services
RBC,RBC Bearings Incorporated Common Stock,$266.18,8.03,3.111%,7741845034.00,United States,2022,255104,Industrials,Metal Fabrications
RBCP,RBC Bearings Incorporated 5.00% Series A Mandatory Convertible Preferred Stock,$122.10,2.48,2.073%,3551278378.00,United States,2022,36351,Industrials,Metal Fabrications
RBLX,Roblox Corporation Class A Common Stock,$44.40,-0.47,-1.047%,27693922711.00,United States,2021,12695285,Technology,EDP Services
RBOT,Vicarious Surgical Inc. Class A Common Stock,$0.41,0.01,2.50%,71704675.00,Hong Kong,2020,306342,Health Care,Medical Specialities
RBT,Rubicon Technologies Inc. Class A Common Stock,$1.15,-0.03,-2.542%,53837395.00,,2022,160246,Technology,Semiconductors
RC,Ready Capital Corproation Common Stock,$9.03,0.15,1.689%,1554285761.00,United States,2013,2373587,Real Estate,Real Estate Investment Trusts
RC^C,Ready Capital Corporation 6.25% Series C Cumulative Convertible Preferred Stock,$19.00,0.00,0.00%,,United States,,20,,
RC^E,Ready Capital Corporation 6.50% Series E Cumulative Redeemable Preferred Stock,$19.37,0.00,0.00%,,United States,,11628,,
RCB,Ready Capital Corporation 6.20% Senior Notes due 2026,$23.99,0.17,0.714%,4129270809.00,United States,2019,4173,Real Estate,Real Estate Investment Trusts
RCC,Ready Capital Corporation 5.75% Senior Notes due 2026,$24.10,-0.01,-0.041%,4148204523.00,United States,2021,4466,Real Estate,Real Estate Investment Trusts
RCFA,RCF Acquisition Corp. Class A Ordinary Shares,$10.98,0.00,0.00%,0.00,,2021,89,Finance,Blank Checks
RCI,Rogers Communication Inc. Common Stock,$45.62,-0.20,-0.436%,24113180920.00,Canada,,337317,,
RCL,Royal Caribbean Cruises Ltd. Common Stock,$116.97,-4.00,-3.307%,29971820115.00,United States,1993,4445341,Consumer Discretionary,Marine Transportation
RCS,PIMCO Strategic Income Fund Inc.,$6.14,-0.06,-0.968%,0.00,United States,1994,171149,Finance,Investment Managers
RCUS,Arcus Biosciences Inc. Common Stock,$15.81,0.60,3.945%,1183466483.00,United States,2018,874724,Health Care,Biotechnology: Pharmaceutical Preparations
RDN,Radian Group Inc. Common Stock,$27.50,0.21,0.77%,4211909295.00,United States,,1799612,Finance,Property-Casualty Insurers
RDW,Redwire Corporation Common Stock,$3.04,0.01,0.33%,196991517.00,United States,2021,86982,Industrials,Military/Government/Technical
RDY,Dr. Reddy's Laboratories Ltd Common Stock,$74.13,0.86,1.174%,12344711448.00,India,,150721,Health Care,Biotechnology: Pharmaceutical Preparations
RELX,RELX PLC PLC American Depositary Shares (Each representing One Ordinary Share),$42.48,0.72,1.724%,80243031802.00,United Kingdom,2015,1423911,Consumer Discretionary,Business Services
RERE,ATRenew Inc. American Depositary Shares (every three of which representing two Class A ordinary shares),$1.09,-0.01,-0.909%,243968365.00,Cayman Islands,2021,103709,Consumer Discretionary,Other Specialty Stores
RES,RPC Inc. Common Stock,$6.94,-0.04,-0.573%,1500624902.00,United States,,1188705,Energy,Oilfield Services/Equipment
REVG,REV Group Inc. Common Stock,$17.33,0.76,4.587%,1035265813.00,United States,2017,788838,Consumer Discretionary,Auto Manufacturing
REX,REX American Resources Corporation,$43.71,0.46,1.064%,765088694.00,United States,,72863,Industrials,Major Chemicals
REXR,Rexford Industrial Realty Inc. Common Stock,$52.66,-0.46,-0.866%,11116384819.00,United States,2013,1326045,Real Estate,Real Estate Investment Trusts
REXR^B,Rexford Industrial Realty Inc. 5.875% Series B Cumulative Redeemable Preferred Stock,$22.46,0.1799,0.807%,,United States,,4289,,
REXR^C,Rexford Industrial Realty Inc. 5.625% Series C Cumulative Redeemable Preferred Stock par value $0.01 per share,$21.33,-0.05,-0.234%,,United States,,10928,,
REZI,Resideo Technologies Inc. Common Stock ,$17.58,0.24,1.384%,2568226899.00,United States,2018,619788,Industrials,Wholesale Distributors
RF,Regions Financial Corporation Common Stock,$18.00,0.11,0.615%,16741168884.00,United States,,9743194,Finance,Major Banks
