Symbol,Name,Last Sale,Net Change,% Change,Market Cap,Country,IPO Year,Volume,Sector,Industry
A,Agilent Technologies Inc. Common Stock,$133.34,-0.73,-0.544%,39073914531.00,United States,1999,909735,Industrials,Biotechnology: Laboratory Analytical Instruments
AA,Alcoa Corporation Common Stock ,$26.89,-0.82,-2.959%,4799109606.00,United States,2016,4760936,Industrials,Aluminum
AACT,Ares Acquisition Corporation II Class A Ordinary Shares,$10.505,-0.005,-0.048%,0.00,,2023,4050,Finance,Blank Checks
AAN,Aarons Holdings Company Inc. Common Stock ,$10.41,-0.04,-0.383%,315727878.00,United States,2020,294930,Miscellaneous,Diversified Commercial Services
AAP,Advance Auto Parts Inc.,$63.30,-0.84,-1.31%,3766475967.00,United States,,1898822,Consumer Discretionary,Auto & Home Supply Stores
AAT,American Assets Trust Inc. Common Stock,$22.26,0.08,0.361%,1351730264.00,United States,2011,522200,Real Estate,Real Estate Investment Trusts
AB,AllianceBernstein Holding L.P.  Units,$33.21,0.31,0.942%,3712774152.00,United States,,289126,Finance,Investment Managers
ABBV,AbbVie Inc. Common Stock,$174.08,-0.71,-0.406%,307344754248.00,United States,2012,3502350,Health Care,Biotechnology: Pharmaceutical Preparations
ABEV,Ambev S.A. American Depositary Shares (Each representing 1 Common Share),$2.58,0.02,0.781%,40635559476.00,Brazil,2013,7027125,Consumer Staples,Beverages (Production/Distribution)
ABG,Asbury Automotive Group Inc Common Stock,$215.92,9.13,4.415%,4443066162.00,United States,2002,290879,Consumer Discretionary,Retail-Auto Dealers and Gas Stations
ABM,ABM Industries Incorporated Common Stock,$40.21,-0.17,-0.421%,2527645555.00,United States,,621876,Finance,Diversified Commercial Services
ABR,Arbor Realty Trust Common Stock,$12.33,0.21,1.733%,2324225246.00,United States,2004,3930095,Real Estate,Real Estate Investment Trusts
ABR^D,Arbor Realty Trust 6.375% Series D Cumulative Redeemable Preferred Stock Liquidation Preference $25.00 per Share,$17.50,0.10,0.575%,,United States,,8484,,
ABR^E,Arbor Realty Trust 6.25% Series E Cumulative Redeemable Preferred Stock,$17.4906,-0.0794,-0.452%,,United States,,3012,,
ABR^F,Arbor Realty Trust 6.25% Series F Fixed-to-Floating Rate Cumulative Redeemable Preferred Stock Liquidation Preference $25.00 per share,$18.00,-0.08,-0.442%,,United States,,64002,,
ABT,Abbott Laboratories Common Stock,$111.81,-0.62,-0.551%,194108704910.00,United States,,5947547,Health Care,Biotechnology: Pharmaceutical Preparations
AC,Associated Capital Group Inc. Common Stock,$33.17,0.41,1.252%,716181530.00,United States,2015,3409,Finance,Investment Bankers/Brokers/Service
ACA,Arcosa Inc. Common Stock ,$83.52,0.95,1.151%,4072432360.00,United States,2018,150920,Industrials,Metal Fabrications
ACCO,Acco Brands Corporation Common Stock,$6.36,0.04,0.633%,603727147.00,United States,,457300,Consumer Discretionary,Publishing
ACEL,Accel Entertainment Inc. ,$10.34,0.13,1.273%,876865957.00,United States,2017,176716,Consumer Discretionary,Services-Misc. Amusement & Recreation
ACHR,Archer Aviation Inc. Class A Common Stock,$5.40,0.22,4.247%,1624199618.00,United States,2020,4684231,Industrials,Aerospace
ACI,Albertsons Companies Inc. Class A Common Stock,$21.20,-0.15,-0.703%,12212045159.00,United States,2020,2244815,Consumer Staples,Food Chains
ACM,AECOM Common Stock,$89.54,1.05,1.187%,12179544280.00,United States,2007,600265,Consumer Discretionary,Military/Government/Technical
ACN,Accenture plc Class A Ordinary Shares (Ireland),$371.67,3.19,0.866%,247840703127.00,Ireland,2001,1482636,Consumer Discretionary,Business Services
ACP,abrdn Income Credit Strategies Fund Common Shares,$6.75,0.02,0.297%,0.00,United States,2011,379366,Finance,Investment Managers
ACP^A,abrdn Income Credit Strategies Fund 5.250% Series A Perpetual Preferred Stock,$23.02,0.32,1.41%,,United States,,3231,,
ACR,ACRES Commercial Realty Corp. Common Stock,$9.83,-0.03,-0.304%,83113938.00,United States,,15865,Real Estate,Real Estate Investment Trusts
ACR^C,ACRES Commercial Realty Corp. 8.625% Fixed-to-Floating Series C Cumulative Redeemable Preferred Stock ,$23.75,-0.055,-0.231%,,United States,,2017,,
ACR^D,ACRES Commercial Realty Corp. 7.875% Series D Cumulative Redeemable Preferred Stock,$21.481,0.031,0.145%,,United States,,4681,,
ACRE,Ares Commercial Real Estate Corporation Common Stock,$8.71,0.05,0.577%,471564260.00,United States,2012,1163251,Real Estate,Real Estate Investment Trusts
ACV,Virtus Diversified Income & Convertible Fund Common Shares of Beneficial Interest,$23.02,0.12,0.524%,238555201.00,United States,2015,28213,Finance,Finance/Investors Services
ADC,Agree Realty Corporation Common Stock,$57.53,-0.44,-0.759%,5782899319.00,United States,,1031649,Real Estate,Real Estate Investment Trusts
ADC^A,Agree Realty Corporation Depositary Shares each representing 1/1000th of a 4.250% Series A Cumulative Redeemable Preferred Stock,$18.91,0.35,1.886%,,United States,,3472,,
ADCT,ADC Therapeutics SA Common Shares,$4.36,0.43,10.941%,351601431.00,,2020,1412861,Health Care,Biotechnology: Pharmaceutical Preparations
ADM,Archer-Daniels-Midland Company Common Stock,$53.05,0.35,0.664%,28295875578.00,United States,,5518776,Consumer Staples,Packaged Foods
ADNT,Adient plc Ordinary Shares ,$34.13,0.51,1.517%,3114221168.00,United States,2016,2418371,Consumer Discretionary,Auto Parts:O.E.M.
ADT,ADT Inc. Common Stock,$6.78,0.14,2.108%,6249948285.00,United States,2018,2761941,Consumer Discretionary,Diversified Commercial Services
ADX,Adams Diversified Equity Fund Inc.,$18.73,-0.07,-0.372%,0.00,United States,,333963,Finance,Investment Managers
AEE,Ameren Corporation Common Stock,$68.70,0.78,1.148%,18064324798.00,United States,,1885815,Utilities,Power Generation
AEFC,Aegon Funding Company LLC 5.10% Subordinated Notes due 2049,$22.58,0.26,1.165%,0.00,United States,2019,27995,,
AEG,Aegon Ltd. New York Registry Shares,$5.79,0.00,0.00%,15376076329.00,Netherlands,,1894407,Finance,Life Insurance
AEL,American Equity Investment Life Holding Company Common Stock,$55.52,0.17,0.307%,4387458340.00,United States,2003,274193,Finance,Life Insurance
AEL^A,American Equity Investment Life Holding Company Depositary Shares each representing a 1/1000th interest in a share of 5.95% Fixed-Rate Reset Non-Cumulative Preferred Stock Series A,$23.48,0.08,0.342%,,United States,,37191,,
AEL^B,American Equity Investment Life Holding Company Depositary Shares each representing a 1/1000th interest in a share of 6.625% Fixed-Rate Reset Non-Cumulative Preferred Stock Series B,$25.35,0.27,1.077%,,United States,,7416,,
AEM,Agnico Eagle Mines Limited Common Stock,$46.62,-0.55,-1.166%,23126481489.00,Canada,,3641721,Basic Materials,Precious Metals
AEO,American Eagle Outfitters Inc. Common Stock,$22.48,0.86,3.978%,4440662108.00,United States,,5465125,Consumer Discretionary,Clothing/Shoe/Accessory Stores
AER,AerCap Holdings N.V. Ordinary Shares,$77.27,-0.04,-0.052%,19003109619.00,Netherlands,2006,1120613,Consumer Discretionary,Diversified Commercial Services
AES,The AES Corporation Common Stock,$16.46,0.26,1.605%,11022093916.00,United States,,5498435,Utilities,Electric Utilities: Central
AESC,The AES Corporation Corporate Units,$65.90,1.32,2.044%,44128553407.00,United States,,6559,Utilities,Electric Utilities: Central
AESI,Atlas Energy Solutions Inc. Common Stock,$17.62,0.34,1.968%,1762000000.00,United States,2023,346086,Industrials,Metal Fabrications
AEVA,Aeva Technologies Inc. Common Stock,$1.07,0.1909,21.715%,239086692.00,United States,2020,2194774,Consumer Discretionary,Auto Parts:O.E.M.
AFB,AllianceBernstein National Municipal Income Fund Inc,$10.825,-0.0094,-0.087%,0.00,United States,2002,84765,Finance,Trusts Except Educational Religious and Charitable
AFG,American Financial Group Inc. Common Stock,$122.76,2.13,1.766%,10284563833.00,United States,,418834,Finance,Property-Casualty Insurers
AFGB,American Financial Group Inc. 5.875% Subordinated Debentures due 2059,$24.40,0.25,1.035%,2044178540.00,United States,2019,3727,Finance,Property-Casualty Insurers
AFGC,American Financial Group Inc. 5.125% Subordinated Debentures due 2059,$22.16,0.38,1.745%,1856516247.00,United States,2019,8352,Finance,Property-Casualty Insurers
AFGD,American Financial Group Inc. 5.625% Subordinated Debentures due 2060,$23.61,0.07,0.297%,1977994070.00,United States,2020,7467,,
AFGE,American Financial Group Inc. 4.500% Subordinated Debentures due 2060,$19.64,0.35,1.814%,1645396169.00,United States,2020,5539,,
AFL,AFLAC Incorporated Common Stock,$78.23,0.12,0.154%,45716038716.00,United States,,1950944,Finance,Accident &Health Insurance
AFT,Apollo Senior Floating Rate Fund Inc. Common Stock,$13.71,-0.05,-0.363%,0.00,,2011,73919,Finance,Investment Managers
AG,First Majestic Silver Corp. Ordinary Shares (Canada),$4.58,-0.07,-1.505%,1314153648.00,Canada,,4424894,,
AGCO,AGCO Corporation Common Stock,$115.04,-2.38,-2.027%,8614187952.00,United States,,746977,Industrials,Industrial Machinery/Components
AGD,abrdn Global Dynamic Dividend Fund Common Shares of Beneficial Interest,$9.42,0.02,0.213%,0.00,United States,2006,47076,Finance,Trusts Except Educational Religious and Charitable
AGI,Alamos Gold Inc. Class A Common Shares,$11.95,-0.15,-1.24%,4735996443.00,Canada,2015,1639199,Basic Materials,Precious Metals
AGL,agilon health inc. Common Stock,$6.82,-0.27,-3.808%,2769199102.00,United States,2021,4818329,Health Care,Managed Health Care
AGM,Federal Agricultural Mortgage Corporation Common Stock,$184.00,2.42,1.333%,1994716768.00,United States,,61061,Finance,Finance Companies
AGM^C,Federal Agricultural Mortgage Corporation Preferred Series C Fixed to Fltg,$24.98,-0.08,-0.319%,,United States,,10075,,
AGM^D,Federal Agricultural Mortgage Corporation 5.700% Non-Cumulative Preferred Stock Series D,$24.45,-0.20,-0.811%,,United States,,2690,,
AGM^E,Federal Agricultural Mortgage Corporation 5.750% Non-Cumulative Preferred Stock Series E,$24.10,0.1001,0.417%,,United States,,991,,
AGM^F,Federal Agricultural Mortgage Corporation 5.250% Non-Cumulative Preferred Stock Series F,$22.0868,0.0368,0.167%,,United States,,1902,,
AGM^G,Federal Agricultural Mortgage Corporation 4.875% Non-Cumulative Preferred Stock Series G,$20.81,0.11,0.531%,,United States,,5262,,
AGO,Assured Guaranty Ltd. Common Stock,$82.23,0.13,0.158%,4708207998.00,Bermuda,2004,357288,Finance,Property-Casualty Insurers
AGR,Avangrid Inc. Common Stock,$30.38,0.36,1.199%,11750100398.00,United States,2015,480903,Utilities,Electric Utilities: Central
AGRO,Adecoagro S.A. Common Shares,$9.83,0.05,0.511%,1063519673.00,Luxembourg,2011,444469,Consumer Staples,Farming/Seeds/Milling
AGS,PlayAGS Inc. Common Stock,$9.04,0.12,1.345%,349958324.00,United States,2018,220110,Consumer Discretionary,Miscellaneous manufacturing industries
AGTI,Agiliti Inc. Common Stock,$7.19,0.26,3.752%,969531502.00,United States,2021,188467,Health Care,Managed Health Care
AGX,Argan Inc. Common Stock,$46.50,0.66,1.44%,619745769.00,United States,,39449,Consumer Discretionary,Engineering & Construction
AHH,Armada Hoffler Properties Inc. Common Stock,$11.91,0.10,0.847%,802747434.00,United States,2013,227936,Finance,Real Estate
AHH^A,Armada Hoffler Properties Inc. 6.75% Series A Cumulative Redeemable Perpetual Preferred Stock,$23.3941,0.4041,1.758%,,United States,,4911,,
AHL^C,Aspen Insurance Holdings Limited 5.95% Fixed-to-Floating Rate Perpetual Non-Cumulative Preference Shares,$25.89,0.01,0.039%,,Bermuda,,11410,,
AHL^D,Aspen Insurance Holdings Limited 5.625% Perpetual Non-Cumulative Preference Shares,$21.46,0.26,1.226%,,Bermuda,,8427,,
AHL^E,Aspen Insurance Holdings Limited Depositary Shares each representing a 1/1000th interest in a share of 5.625% Perpetual Non-Cumulative Preference Shares,$20.60,-0.01,-0.049%,,Bermuda,,8393,,
AHR,American Healthcare REIT Inc. Common Stock,$13.12,0.06,0.459%,0.00,,2024,2062070,Real Estate,Real Estate Investment Trusts
AHT,Ashford Hospitality Trust Inc Common Stock,$1.52,0.01,0.662%,52460347.00,United States,2003,402830,Real Estate,Real Estate Investment Trusts
AHT^D,Ashford Hospitality Trust Inc 8.45% Series D Cumulative Preferred Stock,$13.84,0.04,0.29%,,United States,,1580,,
AHT^F,Ashford Hospitality Trust Inc 7.375% Series F Cumulative Preferred Stock,$11.84,-0.66,-5.28%,,United States,,2980,,
AHT^G,Ashford Hospitality Trust Inc 7.375% Series G Cumulative Preferred Stock,$16.00,-0.41,-2.498%,,United States,,2551,,
AHT^H,Ashford Hospitality Trust Inc 7.50% Series H Cumulative Preferred Stock,$11.83,-0.57,-4.597%,,United States,,1365,,
AHT^I,Ashford Hospitality Trust Inc 7.50% Series I Cumulative Preferred Stock,$11.85,0.00,0.00%,,United States,,22,,
AI,C3.ai Inc. Class A Common Stock,$28.47,1.63,6.073%,3412562159.00,United States,2020,14774310,Technology,Computer Software: Prepackaged Software
AIF,Apollo Tactical Income Fund Inc. Common Stock,$14.39,0.00,0.00%,0.00,,2013,118887,Finance,Finance Companies
AIG,American International Group Inc. New Common Stock,$69.12,0.71,1.038%,48525028508.00,United States,,3214040,Finance,Life Insurance
AIG^A,American International Group Inc. Depositary Shares Each Representing a 1/1000th Interest in a Share of Series A 5.85% Non-Cumulative Perpetual Preferred Stock,$25.23,-0.02,-0.079%,,United States,,46410,,
AIN,Albany International Corporation Common Stock,$90.60,1.58,1.775%,2826720000.00,United States,,78982,Consumer Discretionary,Textiles
AIO,Virtus Artificial Intelligence & Technology Opportunities Fund Common Shares of Beneficial Interest,$19.48,-0.31,-1.566%,668962135.00,,2019,150524,Finance,Finance/Investors Services
AIR,AAR Corp. Common Stock,$63.25,1.90,3.097%,2245540336.00,United States,,278070,Industrials,Aerospace
AIRC,Apartment Income REIT Corp. Common Stock,$31.38,-0.88,-2.728%,4612631271.00,United States,2020,2015316,Real Estate,Real Estate Investment Trusts
AIT,Applied Industrial Technologies Inc. Common Stock,$187.93,3.38,1.831%,7267152557.00,United States,,181034,Consumer Discretionary,Industrial Specialties
AIU,Meta Data Limited ADS,$0.98,-0.025,-2.488%,75434679.00,,2018,5769,Real Estate,Other Consumer Services
AIV,Apartment Investment and Management Company Common Stock,$7.51,0.00,0.00%,1094655137.00,United States,1994,858988,Real Estate,Real Estate Investment Trusts
AIZ,Assurant Inc. Common Stock,$174.49,-0.08,-0.046%,9176537284.00,United States,2004,282437,Finance,Property-Casualty Insurers
AIZN,Assurant Inc. 5.25% Subordinated Notes due 2061,$20.68,0.09,0.437%,1087574022.00,United States,2020,66187,Finance,Specialty Insurers
AJG,Arthur J. Gallagher & Co. Common Stock,$238.84,1.81,0.764%,51565556000.00,United States,,575784,Finance,Specialty Insurers
AJX,Great Ajax Corp. Common Stock,$4.62,0.12,2.667%,126908688.00,United States,2015,366882,Real Estate,Real Estate Investment Trusts
AJXA,Great Ajax Corp. 7.25% Convertible Senior Notes due 2024,$24.89,-0.01,-0.04%,683713690.00,United States,2017,20249,Real Estate,Real Estate Investment Trusts
AKA,a.k.a. Brands Holding Corp. Common Stock,$9.6407,-0.4394,-4.359%,102453743.00,,2021,5277,Consumer Discretionary,Catalog/Specialty Distribution
AKO/A,Embotelladora Andina S.A.,$11.84,-0.16,-1.333%,,Chile,,3082,,
AKO/B,Embotelladora Andina S.A.,$14.565,-0.435,-2.90%,,Chile,,5716,,
AKR,Acadia Realty Trust Common Stock,$16.91,-0.26,-1.514%,1612210899.00,United States,,1220476,Real Estate,Real Estate Investment Trusts
AL,Air Lease Corporation Class A Common Stock,$42.02,0.17,0.406%,4665365129.00,United States,2011,660059,Consumer Discretionary,Diversified Commercial Services
AL^A,Air Lease Corporation 6.150% Fixed-to-Floating Rate Non-Cumulative Perpetual Preferred Stock Series A,$25.23,0.07,0.278%,,United States,,8663,,
ALB,Albemarle Corporation Common Stock,$115.78,1.45,1.268%,13587161832.00,United States,,2491169,Industrials,Major Chemicals
ALC,Alcon Inc. Ordinary Shares,$77.20,0.03,0.039%,38576840000.00,Switzerland,2019,802892,Health Care,Ophthalmic Goods
ALCC,AltC Acquisition Corp. Class A Common Stock,$10.61,0.00,0.00%,0.00,,2021,34509,Finance,Blank Checks
ALE,Allete Inc.,$58.29,0.54,0.935%,3350357937.00,United States,,236309,Utilities,Power Generation
ALEX,Alexander & Baldwin Inc. Common Stock REIT Holding Company,$17.17,-0.04,-0.232%,1245448529.00,United States,,457497,Real Estate,Real Estate Investment Trusts
ALG,Alamo Group Inc. Common Stock,$218.35,2.34,1.083%,2622772381.00,United States,,60565,Industrials,Industrial Machinery/Components
ALIT,Alight Inc. Class A Common Stock,$9.37,0.14,1.517%,5180927798.00,United States,2021,4897973,Consumer Discretionary,Business Services
ALK,Alaska Air Group Inc. Common Stock,$37.19,0.68,1.863%,4762293934.00,United States,,2243597,Consumer Discretionary,Air Freight/Delivery Services
ALL,Allstate Corporation (The) Common Stock,$160.03,-1.72,-1.063%,41877780852.00,United States,,1563884,Finance,Property-Casualty Insurers
ALL^B,Allstate Corporation (The) 5.100% Fixed-to-Floating Rate Subordinated Debentures due 2053,$25.83,0.02,0.077%,,United States,,34113,,
ALL^H,Allstate Corporation (The) Depositary Shares each representing a 1/1000th interest in a share of Fixed Rate Noncumulative Perpetual Preferred Stock Series H,$23.70,0.16,0.68%,,United States,,86487,,
ALL^I,Allstate Corporation (The) Depositary Shares each representing a 1/1000th interest in a share of Fixed Rate Noncumulative Perpetual Preferred Stock Series I,$23.23,0.19,0.825%,,United States,,18653,,
ALL^J,Allstate Corporation (The) Depositary Shares each representing a 1/1000th interest in a share of Fixed Rate Noncumulative Perpetual Preferred Stock Series J,$27.25,0.15,0.554%,,United States,,100883,,
ALLE,Allegion plc Ordinary Shares,$131.91,1.39,1.065%,11580057831.00,United States,2013,780384,Consumer Discretionary,Diversified Commercial Services
ALLG,Allego N.V. Ordinary Share,$1.02,-0.01,-0.971%,272523600.00,Netherlands,2022,36459,Consumer Discretionary,Other Specialty Stores
ALLY,Ally Financial Inc. Common Stock,$36.09,-0.10,-0.276%,10885840956.00,United States,2014,2935787,Finance,Major Banks
ALSN,Allison Transmission Holdings Inc. Common Stock,$61.70,0.03,0.049%,5521206730.00,United States,2012,530639,Consumer Discretionary,Auto Parts:O.E.M.
ALTG,Alta Equipment Group Inc. Class A Common Stock,$11.71,-0.03,-0.256%,379030592.00,United States,2019,237834,Industrials,Industrial Machinery/Components
ALTG^A,Alta Equipment Group Inc. Depositary Shares (each representing 1/1000th in a share of 10% Series A Cumulative Perpetual Preferred Stock),$25.60,-0.07,-0.273%,,United States,,1777,,
ALTM,Arcadium Lithium plc Ordinary Shares,$4.61,0.01,0.217%,4952114789.00,United States,2024,4995464,,
ALUR,Allurion Technologies Inc. Common Stock,$2.76,-0.20,-6.757%,131121227.00,United States,,60864,,
ALV,Autoliv Inc. Common Stock,$110.00,0.50,0.457%,9256316520.00,Sweden,,567522,Consumer Discretionary,Auto Parts:O.E.M.
ALX,Alexander's Inc. Common Stock,$222.22,5.40,2.491%,1134941984.00,United States,,10314,Real Estate,Real Estate Investment Trusts
AM,Antero Midstream Corporation Common Stock,$11.85,-0.07,-0.587%,5684599050.00,United States,2017,1638564,Utilities,Natural Gas Distribution
AMBC,Ambac Financial Group Inc. Common Stock,$15.74,0.16,1.027%,711362012.00,United States,,304959,Finance,Property-Casualty Insurers
AMBP,Ardagh Metal Packaging S.A. Ordinary Shares,$3.64,-0.02,-0.546%,2175227600.00,,,877548,Industrials,Containers/Packaging
AMC,AMC Entertainment Holdings Inc. Class A Common Stock,$4.38,0.29,7.09%,868803213.00,United States,2013,19507811,Consumer Discretionary,Movies/Entertainment
AMCR,Amcor plc Ordinary Shares,$9.10,-0.06,-0.655%,13152623229.00,,2019,8056925,Consumer Discretionary,Miscellaneous manufacturing industries
AME,AMETEK Inc.,$168.50,2.20,1.323%,38889573705.00,United States,,814739,Industrials,Industrial Machinery/Components
AMG,Affiliated Managers Group Inc. Common Stock,$155.89,1.59,1.03%,5270428266.00,United States,,186218,Finance,Investment Managers
AMH,American Homes 4 Rent Common Shares of Beneficial Interest,$35.23,0.21,0.60%,12755230167.00,United States,2013,2249789,Real Estate,Real Estate Investment Trusts
AMH^G,American Homes 4 Rent Series G cumulative redeemable perpetual preferred shares of beneficial interest,$24.0345,0.2245,0.943%,,United States,,5736,,
AMH^H,American Homes 4 Rent Series H cumulative redeemable perpetual Preferred Shares of Beneficial Interest,$25.07,0.435,1.766%,,United States,,7012,,
AMK,AssetMark Financial Holdings Inc. Common Stock,$31.77,0.46,1.469%,2359410424.00,United States,2019,163603,Finance,Finance/Investors Services
AMN,AMN Healthcare Services Inc,$75.73,0.77,1.027%,2861771572.00,United States,,401203,Consumer Discretionary,Professional Services
AMP,Ameriprise Financial Inc. Common Stock,$396.94,2.11,0.534%,40168816452.00,United States,,306793,Finance,Investment Managers
AMPS,Altus Power Inc. Class A Common Stock,$6.42,0.43,7.179%,1027111025.00,United States,2021,1043472,Utilities,Electric Utilities: Central
AMPX,Amprius Technologies Inc. Common Stock,$4.14,-0.16,-3.721%,365960003.00,United States,2022,431030,Miscellaneous,Industrial Machinery/Components
AMPY,Amplify Energy Corp. Common Stock,$6.06,-0.05,-0.818%,236926002.00,United States,2016,331745,Energy,Oil & Gas Production
AMR,Alpha Metallurgical Resources Inc. Common Stock,$370.00,-0.91,-0.245%,4914929780.00,United States,2018,120526,Energy,Coal Mining
AMRC,Ameresco Inc. Class A Common Stock,$22.85,0.46,2.054%,1193558896.00,United States,2010,351851,Consumer Discretionary,Engineering & Construction
AMT,American Tower Corporation (REIT) Common Stock,$194.44,0.80,0.413%,90641145544.00,United States,,1903894,Real Estate,Real Estate Investment Trusts
AMTB,Amerant Bancorp Inc. Class A Common Stock,$22.69,0.53,2.392%,761859725.00,United States,,103640,Finance,Major Banks
AMTD,AMTD IDEA Group American Depositary Shares each representing six (6) Class A Ordinary Shares,$1.75,0.06,3.55%,84045040.00,,,35761,Finance,Finance: Consumer Services
AMWL,American Well Corporation Class A Common Stock,$1.10,0.02,1.852%,316326160.00,United States,2020,875060,Technology,Retail: Computer Software & Peripheral Equipment
AMX,America Movil S.A.B. de C.V. American Depositary Shares (each representing the right to receive twenty (20) Series B Shares,$17.18,-0.11,-0.636%,54396175000.00,Mexico,2023,3281359,Telecommunications,Telecommunications Equipment
AN,AutoNation Inc. Common Stock,$152.17,5.16,3.51%,6470339768.00,United States,,449185,Consumer Discretionary,Retail-Auto Dealers and Gas Stations
ANET,Arista Networks Inc. Common Stock,$282.45,6.56,2.378%,87870235108.00,United States,2014,3155271,Technology,Computer peripheral equipment
ANF,Abercrombie & Fitch Company Common Stock,$110.11,2.79,2.60%,5550151587.00,United States,,1380006,Consumer Discretionary,Clothing/Shoe/Accessory Stores
ANRO,Alto Neuroscience Inc. Common Stock,$16.55,-2.43,-12.803%,0.00,,2024,171489,,
ANVS,Annovis Bio Inc. Common Stock,$10.95,0.11,1.015%,112371889.00,United States,2020,118084,Health Care,Biotechnology: Pharmaceutical Preparations
AOD,abrdn Total Dynamic Dividend Fund Common Shares of Beneficial Interest,$8.07,0.03,0.373%,0.00,United States,2007,191113,Finance,Investment Managers
AOMR,Angel Oak Mortgage REIT Inc. Common Stock,$10.53,0.16,1.543%,262884335.00,United States,2021,43824,Real Estate,Real Estate Investment Trusts
AON,Aon plc Class A Ordinary Shares (Ireland),$312.56,5.38,1.751%,62579620793.00,United States,,1084102,Finance,Specialty Insurers
AORT,Artivion Inc. Common Stock,$17.16,0.17,1.001%,704394113.00,United States,,162922,Health Care,Medical/Dental Instruments
AOS,A.O. Smith Corporation Common Stock,$80.54,0.29,0.361%,11977943271.00,United States,,707610,Consumer Discretionary,Consumer Electronics/Appliances
AP,Ampco-Pittsburgh Corporation Common Stock,$2.43,-0.07,-2.80%,48273770.00,United States,,17905,Industrials,Fluid Controls
APAM,Artisan Partners Asset Management Inc. Class A Common Stock,$42.86,0.47,1.109%,3427122760.00,United States,2013,406704,Finance,Investment Managers
APD,Air Products and Chemicals Inc. Common Stock,$219.84,-0.07,-0.032%,48870663052.00,United States,,2381707,Industrials,Major Chemicals
APG,APi Group Corporation Common Stock,$35.19,0.32,0.918%,8289327192.00,United States,2020,1252982,Consumer Discretionary,Engineering & Construction
APH,Amphenol Corporation Common Stock,$105.29,0.43,0.41%,63158717472.00,United States,,1643155,Technology,Electrical Products
APLE,Apple Hospitality REIT Inc. Common Shares,$16.12,0.06,0.374%,3688372096.00,United States,2015,1337586,Real Estate,Real Estate Investment Trusts
APO,Apollo Global Management Inc. (New) Common Stock,$109.93,2.52,2.346%,62309330189.00,United States,,4078067,Finance,Investment Managers
APO^A,Apollo Global Management Inc. 6.75% Series A Mandatory Convertible Preferred Stock,$63.09,1.26,2.038%,,United States,,16269,,
APOS,Apollo Global Management Inc. 7.625% Fixed-Rate Resettable Junior Subordinated Notes due 2053,$27.04,-0.02,-0.074%,15346694879.00,United States,1987,21411,,
APTV,Aptiv PLC Ordinary Shares,$82.02,0.73,0.898%,22886536083.00,United Kingdom,2011,2928672,Consumer Discretionary,Auto Parts:O.E.M.
AQN,Algonquin Power & Utilities Corp. Common Shares,$5.79,0.04,0.696%,3990120768.00,United States,2016,2645263,Utilities,Electric Utilities: Central
AQNB,Algonquin Power & Utilities Corp. 6.20% Fixed-to-Floating Subordinated Notes Series 2019-A due July 1 2079,$24.99,0.04,0.16%,17221609325.00,United States,2019,14908,Utilities,Electric Utilities: Central
AQNU,Algonquin Power & Utilities Corp. Corporate Units,$20.63,-0.09,-0.434%,14216958798.00,United States,2021,34909,Utilities,Electric Utilities: Central
AR,Antero Resources Corporation Common Stock,$21.14,-0.49,-2.265%,6353500160.00,United States,2013,5457695,Energy,Oil & Gas Production
